DocId,Tweet,Score,ProecessedTweet,RetweetCount
4042,KOSSACKS ON TWITTER TONIGHT: Use #DKden To Interact with Fellow Kossacks http://t.co/Fu3p1Eyw via @dailykos #Obama2012 #DenverDebates,14.666907,kossacks on twitter tonight use #dkden to interact with fellow kossacks via #obama2012 #denverdebates,1
3135,Mention of #communitycolleges! Key to retraining for where the jobs will be. #debates,14.664480999999999,mention of #communitycolleges key to retraining for where the jobs will be #debates,0
1740,@cnnbrk I'm not sure how I feel about those lines.......something seems off #debates,14.655995,i'm not sure how i feel about those linessomething seems off #debates,0
700,why am i so nervous watching this debate .. u'd think i was obama #Obama2012,14.655785000000002,why am i so nervous watching this debate u'd think i was obama #obama2012,2
1497,for all the jobs that are out there Huh Mr. Obama? #debates,14.649132999999999,for all the jobs that are out there huh mr obama #debates,0
3670,I think President Obama is going to take a page out of Billy Madison...I pick..Business ethicsss...,14.648137,i think president obama is going to take a page out of billy madisoni pickbusiness ethicsss,0
3555,Did Mitt Romney just flirt with Barack Obama in front of Michelle?,14.645696999999998,did mitt romney just flirt with barack obama in front of michelle,0
3833,Obama's hand movements remind me of episode of Glee where the singers swung their hair wildly to distract from the bad singing #denverdebate,14.628080999999998,obama's hand movements remind me of episode of glee where the singers swung their hair wildly to distract from the bad singing #denverdebate,0
1124,Obama starts by thanking the Univ of Denver --  and #MittRomney starts writing! LOL (scribble scribble...I'm in Denver...) LOL #nbcpolitics,14.623052000000001,obama starts by thanking the univ of denver and #mittromney starts writing lol scribble scribblei'm in denver lol #nbcpolitics,0
2275,I wonder what they say to each other when they shake hands before the debate begins  #decision2012,14.616528,i wonder what they say to each other when they shake hands before the debate begins #decision2012,0
5545,Time to see what these people have to offer to our country! #PresidentialDebate,14.606879999999999,time to see what these people have to offer to our country #presidentialdebate,0
294,Obama: Here's what we need to do... If only he knew someone in the White House who could do something. #DenverDebate,14.604754,obama here's what we need to do if only he knew someone in the white house who could do something #denverdebate,0
249,I'm sure this is the most romantic place you could imagine -- here with me! - @MittRomney to POTUS #DenverDebate,14.598941,i'm sure this is the most romantic place you could imagine here with me to potus #denverdebate,0
4759,Is it wrong that I'm picturing the SNL #debates skit during the debate?,14.591714,is it wrong that i'm picturing the snl #debates skit during the debate,0
3738,Great intro by Romney! Telling those not familiar how Romney will be different than Obama. Facts --  facts --  facts. #DenverDebate,14.591518,great intro by romney telling those not familiar how romney will be different than obama facts facts facts #denverdebate,0
8,Professor @rotolo and students from #ElectionClass watch the #debates in our social media lab - http://t.co/ZBMJAhK0,14.577955,professor and students from #electionclass watch the #debates in our social media lab,4
3228,Will be watching the Presidential debate while on the treadmill at Anytime! #multitasking #PresidentialDebate #brenchelchallenge,14.577037,will be watching the presidential debate while on the treadmill at anytime #multitasking #presidentialdebate #brenchelchallenge,0
4741,Obama: I am going to improve the entire economy by hiring teachers. #PresidentialDebate #ummmmwhat?,14.566416,obama i am going to improve the entire economy by hiring teachers #presidentialdebate #ummmmwhat,0
976,Obama's investments = spend lots of your money on wasteful programs that don't work. #PresidentialDebate,14.564291,obama's investments spend lots of your money on wasteful programs that don't work #presidentialdebate,0
1468,The love President Obama has for his wife is simply amazing!!,14.540354,the love president obama has for his wife is simply amazing,0
1686,LOL RT @piersmorgan: HAIR ZING! President Obama looks marginally greyer than Governor Romney --  despite being 14yrs younger. #PMTdebate,14.533377,lol rt hair zing president obama looks marginally greyer than governor romney despite being 14yrs younger #pmtdebate,0
1727,Never been into politics but I guess it's never too late to start. #PresidentialDebate,14.526209,never been into politics but i guess it's never too late to start #presidentialdebate,0
68,The first thing out of Obama fat month is a lie! #debates,14.525803,the first thing out of obama fat month is a lie #debates,0
2314,I don't agree w/ Romneys policies but that was a decent intro. #denverdebate #EssenceDebate,14.517217,i don't agree w romneys policies but that was a decent intro #denverdebate #essencedebate,0
4824,Did they intentionally put repub on the left and dem on right? #debates,14.49401,did they intentionally put repub on the left and dem on right #debates,0
580,if u like mitt romney im not saying ur choice is wrong but it is so wtf is wrong with u,14.488428000000003,if u like mitt romney im not saying ur choice is wrong but it is so wtf is wrong with u,10
3483,I soooo don't understand where the real time undecided voter ticker is coming from. #denverdebate #cnn,14.486659,i soooo don't understand where the real time undecided voter ticker is coming from #denverdebate #cnn,0
1312,Was not stimulus#1 an ENORMOUS investment? How was that ROI --  Obama? Answer: not good. #debates,14.480912,was not stimulus# an enormous investment how was that roi obama answer not good #debates,0
475,Barack Obama dan Mitt Romney berhadapan untuk pertama kalinya dalam debat kandidat Presiden AS di Universitas De... http://t.co/tFQW9IXW,14.465757,barack obama dan mitt romney berhadapan untuk pertama kalinya dalam debat kandidat presiden as di universitas de,0
2403,There are some things you cant debate such as the bold --  smooth flavor of BACARDI OakHeart #Debates,14.440837000000002,there are some things you cant debate such as the bold smooth flavor of bacardi oakheart #debates,0
665,#Obama --  new math teachers? GOOOD BYE MRS BOWMAN HAVE A NICE LIFE.,14.430513000000001,#obama new math teachers goood bye mrs bowman have a nice life,0
1038,Hacking up a lung from allergies/cold. Hacking up a brain from #debates. Which will disable me first? Taking bets.,14.415938999999998,hacking up a lung from allergiescold hacking up a brain from #debates which will disable me first taking bets,0
2343,This debate makes me realize that the unemployment of all my young peers is NOT the norm.... #denverdebate,14.399687,this debate makes me realize that the unemployment of all my young peers is not the norm #denverdebate,0
2646,The first national security shot of the debate: #Obama accuses #Romney of $2 trillion in defense spending the #Pentagon has not requested.,14.396010999999998,the first national security shot of the debate #obama accuses #romney of trillion in defense spending the #pentagon has not requested,3
454,OH in liveblog: Is it me -- but i'm already zoning out on the Obama answer. via @waltershapiroPD http://t.co/uZrYVSdT #Debates,14.394103999999999,oh in liveblog is it me but i'm already zoning out on the obama answer via #debates,0
2855,When hearing Romney speak I dose off but when I hear Obama speak its like my brain jumps into attention mode #obama#obama#obama,14.384478,when hearing romney speak i dose off but when i hear obama speak its like my brain jumps into attention mode #obama#obama#obama,0
2494,#debates Ladies and gentlemen --  boys and girls. RICH GREEDY WHITE-BOY ASS-KICKING TIME'S HERE!! GO OBAMA!,14.373188000000003,#debates ladies and gentlemen boys and girls rich greedy whiteboy asskicking time's here go obama,0
1620,Romney looks focused and relaxed... Ohhh and very Presidential!!  Great opening Mitt!!,14.372742,romney looks focused and relaxed ohhh and very presidential great opening mitt,0
5586,Yoo my teacher making me answer 20 questions bout these #Debates where they do that at...,14.368321,yoo my teacher making me answer questions bout these #debates where they do that at,0
5590,I like the 5 point breakdown #MittRomney.. Although I would love to hear some details.,14.367369,i like the point breakdown #mittromney although i would love to hear some details,0
2280,Whoever did Barack's #debates makeup BEAT HIS FACE. Is that NC45 MakeUpForever? Meanwhile --  Mitt used browning oil. WOMP.,14.362655000000002,whoever did barack's #debates makeup beat his face is that nc45 makeupforever meanwhile mitt used browning oil womp,0
921,#POTUS on #jobs It's gonna be up to the voters --  to you --  about which path we take #DenverDebate,14.340938000000001,#potus on #jobs it's gonna be up to the voters to you about which path we take #denverdebate,0
2358,RT @annmcelhinney: @DLoesch #JeremiahWright married #Obama and Michelle 20 years ago today. Do you think #obama will give him a shout ou ...,14.337637,#jeremiahwright married #obama and michelle years ago today do you think #obama will give him a shout ou,36
3405,I should tell my story. I'm also unemployed. Mitt Romney --  speaking in 2011 to unemployed people in Florida. #denverdebate,14.334685,i should tell my story i'm also unemployed mitt romney speaking in to unemployed people in florida #denverdebate,2
4443,I wonder if there is any Conspiracy Theorists in the Audience --  just waiting to blurt out Are you a lizard? #debates,14.325429999999999,i wonder if there is any conspiracy theorists in the audience just waiting to blurt out are you a lizard #debates,0
1102,Mitt romney hair don't move I don't like him --  I don't trust any man who puts moose in his hair,14.323079999999997,mitt romney hair don't move i don't like him i don't trust any man who puts moose in his hair,0
4953,literally everywhere i go i see mitt romney on peoples bumpers ugh why must i live in a republican state http://t.co/2QcIAUAw,14.309298,literally everywhere i go i see mitt romney on peoples bumpers ugh why must i live in a republican state,0
4412,what is the difference between you?! If you haven't figured it out by now hit yourself in the head w/ a tack hammer #PresidentialDebate,14.2835,what is the difference between you if you haven't figured it out by now hit yourself in the head w a tack hammer #presidentialdebate,0
3871,My father has the #PresidentialDebate drinking game up and I've made pia coladas. Ready --  set --  go!,14.280726999999999,my father has the #presidentialdebate drinking game up and i've made pia coladas ready set go,0
4286,RT @marcustroy #debates this is going to be very interesting. <-- even the Canadians care!! Haa,14.279733,#debates this is going to be very interesting even the canadians care haa,1
4626,Time for the #debates  I think I can give the yankees a break for a while,14.235219,time for the #debates i think i can give the yankees a break for a while,0
4409,How come obama did not make use of th victory against Benladen yet? #debates,14.234749999999998,how come obama did not make use of th victory against benladen yet #debates,0
713,@FauxTWoods: @FauxMattRyan: Would love to be getting a BJ while watching the #debates  I am right.......NOW!!   #jealous,14.234212,would love to be getting a bj while watching the #debates i am rightnow #jealous,0
4326,President Obama discussing where we are going moving forward and not all the failures of the past 4 years. #hlf,14.229391,president obama discussing where we are going moving forward and not all the failures of the past years #hlf,0
1453,Mitt Romney made me laugh --  President Obama didn't. Guess whose ahead in my book! #NBCPolitics #Romney #Obama,14.225665,mitt romney made me laugh president obama didn't guess whose ahead in my book #nbcpolitics #romney #obama,0
679,It would be a lot better if they trash talked each other --  rather than make valid points. #PresidentialDebate,14.223992999999998,it would be a lot better if they trash talked each other rather than make valid points #presidentialdebate,0
5109,.@MittRomney otoh does NOT have a similar view to any time in the previous 18 years! #DebateWatch #Debates,14.223634,otoh does not have a similar view to any time in the previous years #debatewatch #debates,0
1696,Obama playing on the stings of American's hearts with his me-and-Michelle move. Sweet but let's stay on task --  POTUS. #debates,14.214102,obama playing on the stings of american's hearts with his meandmichelle move sweet but let's stay on task potus #debates,0
1037,I feel like I'm going to be bored for the next 1 1/2 hours.. #presidentialdebate,14.197554,i feel like i'm going to be bored for the next hours #presidentialdebate,0
4233,#Romney says this is a romantic place here with him to #Obama about his anniversary #PresDebate,14.140971,#romney says this is a romantic place here with him to #obama about his anniversary #presdebate,0
952,President Obama is setting table for Mitt to confront the awful record--Energy? Investment? Get 'im --  Mitt!,14.132196,president obama is setting table for mitt to confront the awful recordenergy investment get im mitt,1
2250,Romney is trying to humanize himself as a baby lover within the first minute. #debates,14.124911,romney is trying to humanize himself as a baby lover within the first minute #debates,0
78,Where Are They Now: I just figured out that Mitt Romney played the original Eddie Munster. The hair gave it away.,14.121763999999999,where are they now i just figured out that mitt romney played the original eddie munster the hair gave it away,0
138,Obama didn't directly address the fundamental problem with trickle-down. He decided to answer the question he wanted. #PresidentialDebate,14.120982999999999,obama didn't directly address the fundamental problem with trickledown he decided to answer the question he wanted #presidentialdebate,0
4489,An unemployed woman in Dayton asked #Mitt --  can you help me? He replies Yes --  can you iron?,14.11493,an unemployed woman in dayton asked #mitt can you help me he replies yes can you iron,0
3703,Oh --  Mittens --  you do make me laugh at your nonsensical approach to life. #presidentialdebate,14.110424,oh mittens you do make me laugh at your nonsensical approach to life #presidentialdebate,0
70,How come the Pres is using we instead of I tonight?  #debates,14.107351,how come the pres is using we instead of i tonight #debates,0
1353,O Obama it's so cute that you think you know how the economy works #nobama,14.105576,o obama it's so cute that you think you know how the economy works #nobama,0
3765,Mitt romney just said number 2 and it made me laugh lol,14.098748999999998,mitt romney just said number and it made me laugh lol,0
1249,With no Specifics as usual. RT @RLM_3: Mitt Romney is trying to hard to sound moderate. #Debates,14.098740000000001,with no specifics as usual rt mitt romney is trying to hard to sound moderate #debates,0
2407,Obama por un nuevo patriotismo que ayude a la clase media. Lo importante no es donde estamos --  sino hacia donde vamos #DenverDebate,14.079296,obama por un nuevo patriotismo que ayude a la clase media lo importante no es donde estamos sino hacia donde vamos #denverdebate,0
2079,When Mitt Romney talks --  all I hear is that sound the adults make from Charlie Brown... Wom womp womp womp wom,14.061103999999998,when mitt romney talks all i hear is that sound the adults make from charlie brown wom womp womp womp wom,0
5260,Someboy killed himself and his wife because he didnt want Obama to be president again #Lol,14.04989,someboy killed himself and his wife because he didnt want obama to be president again #lol,0
4709,see how #obama did that! simple gave examples! Don't talk the talk if you cant walk the walk Romney,14.048957999999999,see how #obama did that simple gave examples don't talk the talk if you cant walk the walk romney,0
4475,I think a key component of these debates will be how all the proposed actions will be paid for #debates,14.037492,i think a key component of these debates will be how all the proposed actions will be paid for #debates,0
3073,Their ties are color coded for your electoral party convenience. (Also skin tone.) #debates #zingers,14.036014999999999,their ties are color coded for your electoral party convenience also skin tone #debates #zingers,0
1160,Watching #debates but also unsure how I feel about #Redsox going down with a whimper,14.031932999999999,watching #debates but also unsure how i feel about #redsox going down with a whimper,0
540,Mitt Romney is talking is much bull. Don't laugh when my president is speaking,14.031785,mitt romney is talking is much bull don't laugh when my president is speaking,0
613,I'm tired of #debates. Let's try some random --  entertaining method of gaining insight from our candidates. I recommend Would you rather...,14.030118000000002,i'm tired of #debates let's try some random entertaining method of gaining insight from our candidates i recommend would you rather,0
7,I wish I could #debates these fools stop #mudslingin and start fixing shit,14.021548,i wish i could #debates these fools stop #mudslingin and start fixing shit,0
894,Whoot whoot Race To The Top that's the grant I work for/with!! #RT3 #Obama2012,14.020757999999997,whoot whoot race to the top that's the grant i work forwith #rt3 #obama2012,0
565,A Romney joke.  Hold your ribs folks this could be a long debate. #DenverDebate,14.019223,a romney joke hold your ribs folks this could be a long debate #denverdebate,0
5385,The question isn't where we've been --  but where we are going -President Obama @RhetoricRox #2012Debate,14.010736,the question isn't where we've been but where we are going president obama #2012debate,0
5323,RT @taySHUTUP: Mitt Romney is worried about North America because? you're running for the PRESIDENT of the United States... Thats the USA,13.989841,mitt romney is worried about north america because you're running for the president of the united states thats the usa,3
3997,Mitt Romney used a great strategy by starting off with a narrative to transition int his point.    He definitely gets points for that.,13.987572,mitt romney used a great strategy by starting off with a narrative to transition int his point he definitely gets points for that,3
1910,Mitt Romney instead of standing & making your speech take a seat & listen to the current & next President...Barack Obama.,13.987442,mitt romney instead of standing making your speech take a seat listen to the current next presidentbarack obama,1
62,Mitt Romney is frantically writing a Happy Anniversary card to the Obamas.  He forgot!,13.985131999999998,mitt romney is frantically writing a happy anniversary card to the obamas he forgot,87
1359,.@MittRomney immediately goes into 5-part plan break down familiar to all those who have ever seen him on the stump. #DenverDebate,13.985071000000001,immediately goes into part plan break down familiar to all those who have ever seen him on the stump #denverdebate,3
1289,How much you want to bet that Romney counters with sweetheart and not sweetie. #debates,13.982232,how much you want to bet that romney counters with sweetheart and not sweetie #debates,0
1075,RT @Nickadoo: Mitt Romney still has a chance to turn things around in the debates. All he needs to do is convince voters that he's not M ...,13.978878,mitt romney still has a chance to turn things around in the debates all he needs to do is convince voters that he's not m,105
5000,Obama didn't mention switch grass as a solution to reducing oil use. NO VOTE FROM ME. #denverdebate,13.971359,obama didn't mention switch grass as a solution to reducing oil use no vote from me #denverdebate,0
3257,#debates shutup mitt romney nobody asked for your opinion did you just offer obama sex,13.966394,#debates shutup mitt romney nobody asked for your opinion did you just offer obama sex,0
5165,Obama: The question here tonight is not where we've been but where we're going. #DenverDebate,13.961113000000001,obama the question here tonight is not where we've been but where we're going #denverdebate,2
1246,Obama: In case you forgot --  I am married to Michelle Obama. Also --  she is very very popular. #debates,13.960308999999999,obama in case you forgot i am married to michelle obama also she is very very popular #debates,59
2442,Mitt Romney Just Needs a Space Suit and He Can Be the new Buzz Light Year,13.948383,mitt romney just needs a space suit and he can be the new buzz light year,0
4343,Mitt Romney swings first with the personal stories of fake Americans. #debate2012,13.939995999999999,mitt romney swings first with the personal stories of fake americans #debate2012,3
1831,MT @Suntimes It's show time: Mitt Romney and Barack Obama begin #denverdebate. Follow along with our pundits: http://t.co/uvmJUL0X,13.938208999999999,mt it's show time mitt romney and barack obama begin #denverdebate follow along with our pundits,0
4960,@MittRomney --  what did you tell that lady when she asked for help? Was she part of the 47%. #Debates,13.935942,what did you tell that lady when she asked for help was she part of the #debates,1
3853,We must vote for Obama to prevent Mitt Romney from lowering the corporate tax rate oh wait WHOOPS,13.93594,we must vote for obama to prevent mitt romney from lowering the corporate tax rate oh wait whoops,2
2701,Why yes --  my famil is gathered around the tv watching the #Debates,13.935458,why yes my famil is gathered around the tv watching the #debates,0
4044,On our 20th anniversary --  we where no where near Mitt Romney.  Just saying.,13.921119000000001,on our 20th anniversary we where no where near mitt romney just saying,0
2996,I'm not a Romney fan... I see right thru his lies  #TeamObama,13.921046,i'm not a romney fan i see right thru his lies #teamobama,0
5175,Lookee #Obama has a US Flag Pin. I thought he was too good for that,13.905005,lookee #obama has a us flag pin i thought he was too good for that,0
5253,I've prepared a glass of fine Kentucky bourbon and I am now ready to commence eye-rolling. #DenverDebate,13.888461,i've prepared a glass of fine kentucky bourbon and i am now ready to commence eyerolling #denverdebate,0
4180,Romney opens by saying what's wrong --  but didn't mention how to fix it.  Not a surprise. #debates,13.887391000000001,romney opens by saying what's wrong but didn't mention how to fix it not a surprise #debates,0
3133,Sadly I'm at the library studying Bt I will be watchin tht debate for sure. #Obama2012,13.885280999999999,sadly i'm at the library studying bt i will be watchin tht debate for sure #obama2012,0
393,Less then 2 min in and the BS from President Obama has already begun,13.872834000000001,less then min in and the bs from president obama has already begun,0
775,Obama opens with wishing his wife a happy anniversary...a crushing blow to Romney --  in deed. #PresidentialDebate,13.863999,obama opens with wishing his wife a happy anniversarya crushing blow to romney in deed #presidentialdebate,1
1283,#PresidentialDebate - both Romney and Obama - schools cannot improve if the youth of America don't want to learn. The culture has to change!,13.853369999999998,#presidentialdebate both romney and obama schools cannot improve if the youth of america don't want to learn the culture has to change,0
5049,Watchin Mitt Romney makes me feel like im watchin a boring ass infomercial ugghh,13.851892,watchin mitt romney makes me feel like im watchin a boring ass infomercial ugghh,2
3606,Must be Jonathan's Dirt RT @sarah_ross: wow - mitt romney's hair is AMAZING tonight . . . massive volume,13.840801999999998,must be jonathan's dirt rt wow mitt romney's hair is amazing tonight massive volume,0
2608,Can you guys at least pretend to think independently during the debates? Hyperbole & propaganda for your candidate so soon is #DenverDebate,13.825743,can you guys at least pretend to think independently during the debates hyperbole propaganda for your candidate so soon is #denverdebate,0
5200,Let's go President Obama! Best blessings Mitt Romney. Let's better the plight Of world.,13.808852,let's go president obama best blessings mitt romney let's better the plight of world,0
121,i've been out of work for three years can ya help me? you talking to me? #mittromney,13.777377000000001,i've been out of work for three years can ya help me you talking to me #mittromney,11
5572,#Romney has GOT to own the energy conversation tonight - traditionally GOP issue and gigantic in CO --  OH --  PA,13.771643999999998,#romney has got to own the energy conversation tonight traditionally gop issue and gigantic in co oh pa,1
1856,RT @current: .@algore quotes Maya Angelou re: Romney's #47percent: If somebody tells you who they are: believe them the first time.  ...,13.754311,quotes maya angelou re romney's #47percent if somebody tells you who they are believe them the first time,23
4064,Obama & Romney shake hands. Both are thinking: your ass is grass! #debates,13.744201,obama romney shake hands both are thinking your ass is grass #debates,2
3278,Mitt Romney's programmers sitting on the sidelines --  desperately hoping he doesn't go into an infinite loop. #debate,13.728241,mitt romney's programmers sitting on the sidelines desperately hoping he doesn't go into an infinite loop #debate,0
5449,RT @showtimeshelby: @J_Mayo23 Very simple choice for America.   Loving the enthusiasm man. Keep up the support!!  #romneyryan2012,13.727932000000001,very simple choice for america loving the enthusiasm man keep up the support #romneyryan2012,1
