DocId,Tweet,Score,ProecessedTweet,RetweetCount
4307,Even though I will be Barack-ing the vote this year --  I do want to point out Mitt Romney just called out my hometown! #DaytonOhio,20.092095,even though i will be baracking the vote this year i do want to point out mitt romney just called out my hometown #daytonohio,0
4859,Just turned on a TV for the first time in more than 3 months. #debates,20.077019999999997,just turned on a tv for the first time in more than months #debates,0
3635,I hope all you tweeters are watching the First Presidential Debate #2012 #VOTE #presidentialdebate http://t.co/ZlJCYwhX,20.069748,i hope all you tweeters are watching the first presidential debate # #vote #presidentialdebate,0
864,You never realize how long 2 minutes can take until you watch #debates.,20.044731,you never realize how long minutes can take until you watch #debates,0
3962,RT @nationaljournal: OK --  you've seen our #debates drinking game rules http://t.co/6uNcA2Aq Now --  propose your OWN rules! We'll RT the bes ...,20.034338,ok you've seen our #debates drinking game rules now propose your own rules we'll rt the bes,1
4596,Wow --  it took him one question to start dodging the point #NObama,20.007671,wow it took him one question to start dodging the point #nobama,0
162,I hope that Mitt Romney does something to indicate when he uses one of his #zingers. He should wink or something.,19.996588000000003,i hope that mitt romney does something to indicate when he uses one of his #zingers he should wink or something,0
2514,So --  was Obama going to bring any new material to this debate --  or.... #debates,19.991411,so was obama going to bring any new material to this debate or #debates,0
1558,Mitt Romney starts by talking about unemployed people he's met. Doesn't mention Let Detroit Go Bankrupt. http://t.co/UYR81aUD,19.985173000000003,mitt romney starts by talking about unemployed people he's met doesn't mention let detroit go bankrupt,2
2044,I'm sure this is the most romantic place you could imagine - here with me --  says Romney to Obama --  in light of the President's anniversary.,19.979541,i'm sure this is the most romantic place you could imagine here with me says romney to obama in light of the president's anniversary,0
1738,Romney is focusing on the now --  Obama the future. I'd rather fix the problem for the future to prevent it from getting bad again. #Obama2012,19.975477,romney is focusing on the now obama the future i'd rather fix the problem for the future to prevent it from getting bad again #obama2012,1
4380,#Obama the question was how will you create jobs?! You didn't answer the question! #CantAfford4More,19.966556999999998,#obama the question was how will you create jobs you didn't answer the question #cantafford4more,0
3956,Did Obama say keep Tuition low ? I hope all you Romney students heard that. #TeamObama,19.951576,did obama say keep tuition low i hope all you romney students heard that #teamobama,7
2394,I want Obama to look at Romney and say bitch please when are you going to stop talking! #Forward2012,19.948094,i want obama to look at romney and say bitch please when are you going to stop talking #forward2012,0
4687,RT @morganschilhab: Ready to watch Romney kick some ass tonight in the debate!,19.937708,ready to watch romney kick some ass tonight in the debate,3
3047,Presidential debates epitomize the bullshit of the two party system. That being said --  #Obama2012,19.919479,presidential debates epitomize the bullshit of the two party system that being said #obama2012,0
1410,In a nutshell #Romney advocates smaller govt. --  private sector solutions. President #Obama advocates bigger govt. solutions. Round 1 to Mitt,19.911744,in a nutshell #romney advocates smaller govt private sector solutions president #obama advocates bigger govt solutions round to mitt,0
1733,Obama wastes no time in appeasing the unions --   I want to create 150 -- 000 new teaching jobs #DenverDebate,19.910805,obama wastes no time in appeasing the unions i want to create new teaching jobs #denverdebate,0
4719,#Obama will get his tonight shout out to his wife in front of millions! He knows what he is doing.,19.893993,#obama will get his tonight shout out to his wife in front of millions he knows what he is doing,1
1478,Its something how Romney opens his debate with an Ohio reference... a state he's hugely unpopular. #debates,19.889495,its something how romney opens his debate with an ohio reference a state he's hugely unpopular #debates,1
1140,RT @MeezSkurt Well your husband might just be a bad worker smh...4 jobs in 3 months!?! #PresidentialDebate,19.883325,well your husband might just be a bad worker smh jobs in months #presidentialdebate,1
2162,Obama was asked to respond to Romney's assertion that the president supports tickle-down government. He hasn't really addressed it.,19.883214,obama was asked to respond to romney's assertion that the president supports tickledown government he hasn't really addressed it,2
2429,Waiting for Obama to say Live from New York --  it's Saturday night! #Debates,19.880792999999997,waiting for obama to say live from new york it's saturday night #debates,0
557,Focused --  debate on and Obama is looking prepared and ready for all that comes at him. #VOTEFOROBAMA #Debates #CNN #MSNBC,19.873873,focused debate on and obama is looking prepared and ready for all that comes at him #voteforobama #debates #cnn #msnbc,1
1306,#Mitt has lost his orange glow I see and is trying to begin with showing his less robot side #debates,19.856166,#mitt has lost his orange glow i see and is trying to begin with showing his less robot side #debates,0
3864,Of course Obama starts answering the question by not actually answering #Debates,19.847696,of course obama starts answering the question by not actually answering #debates,0
1925,Watching the #Debates for the next president still have no clue who to vote for???,19.836535999999995,watching the #debates for the next president still have no clue who to vote for,0
1019,Gov. Romney --  why didn't you give that woman that grabbed your arm in Ohio a piece of that 200 Million Dollar Pie?! O___o #Debates,19.830585000000003,gov romney why didn't you give that woman that grabbed your arm in ohio a piece of that million dollar pie oo #debates,0
4673,Watching the presidential debate wit my boys Jesse --  Liam --  and Luke!! S/o to Luke for the pizza!! #Obama2012,19.819789,watching the presidential debate wit my boys jesse liam and luke so to luke for the pizza #obama2012,0
2208,Want to tell you that in regulation happy Euro-welfare states --  small business makes up bigger part of economy #Romney http://t.co/HhSjy99s,19.815961,want to tell you that in regulation happy eurowelfare states small business makes up bigger part of economy #romney,0
4827,Watching the #Debates super geeked! I love listening to my president with his sexy self!,19.805983999999995,watching the #debates super geeked i love listening to my president with his sexy self,0
2404,Debating Mitt Romney must be a really crappy way to spend a wedding anniversary. #debate,19.802350999999998,debating mitt romney must be a really crappy way to spend a wedding anniversary #debate,0
1631,How is it possible that Mitt Romney did not mention Tim Tebow as one of his 5 points to success?  #usethewildcatromney #debates,19.800563,how is it possible that mitt romney did not mention tim tebow as one of his points to success #usethewildcatromney #debates,0
1492,Romney's opening statement is more personal --  specific --  clearer & convincing than Obama's #PresidentialDebate,19.799115,romney's opening statement is more personal specific clearer convincing than obama's #presidentialdebate,0
2585,Yeah Obama --  please tell us how to close the deficit that you added 10 trillion to? #debates,19.797499999999996,yeah obama please tell us how to close the deficit that you added trillion to #debates,0
5482,Will now be referring to Mittens as Charly from this point on. Thanks --  Daily Show. #debates #flowersforalgernongameproper,19.794406,will now be referring to mittens as charly from this point on thanks daily show #debates #flowersforalgernongameproper,0
4144,RT @andcierasaid: Happy anniversary Michelle and Barak Obama. Happy to be celebrating with you.,19.793470000000003,happy anniversary michelle and barak obama happy to be celebrating with you,0
702,AMEN!!! @CHANEL__BABii: word! @jeremiahKOEking: s/o to President OBAMA putting his WIFE Michelle FIRST!,19.789134,amen word so to president obama putting his wife michelle first,0
734,Is it just me or is Romney wearing an ill fitting suit? Was never the case in the GOP primary debates. #DenverDebate,19.785931,is it just me or is romney wearing an ill fitting suit was never the case in the gop primary debates #denverdebate,0
5189,AHORA EN VIVO: ve el debate presidencial entre Barack Obama y Mitt Romney. http://t.co/thtJ0fyh,19.776761999999998,ahora en vivo ve el debate presidencial entre barack obama y mitt romney,1
1578,Will increasing #infrastructure spending help the #economy? Candidates are answering; Take a stand at: http://t.co/FflRj8gE #debates,19.751426,will increasing #infrastructure spending help the #economy candidates are answering take a stand at #debates,0
2370,President Obama has to argue with this slimeball instead of celebrating his 20th anniversary with Mrs. O. That sucks.,19.742242999999995,president obama has to argue with this slimeball instead of celebrating his 20th anniversary with mrs o that sucks,0
5451,this is the first time i've actually heard a plan from Romney. #debates,19.718694,this is the first time i've actually heard a plan from romney #debates,0
4615,@makhondlovu: #Obama2012 I said hell yeah --  hell yeah f*cking right --  damned right alright,19.712316,#obama2012 i said hell yeah hell yeah fcking right damned right alright,0
5534,Barack Obama wants to forget the past because then he'd have to answer for his failures. #tcot #debate2012,19.71103,barack obama wants to forget the past because then he'd have to answer for his failures #tcot #debate2012,1
1016,Obama may have a program called Race to the Top --  but while he's been President our economy has raced to the bottom and stayed there.,19.708407,obama may have a program called race to the top but while he's been president our economy has raced to the bottom and stayed there,0
3439,@JedediahBila so are you going to jump Mitt Romney for acknowledging President Obama's anniversary?,19.702322000000002,so are you going to jump mitt romney for acknowledging president obama's anniversary,0
4096,#Romney  Republican Pres Bush entered the White House with a SURPLUS & before he had time 2 turn on lights the surplus was gone.i e prob #1,19.700087000000003,#romney republican pres bush entered the white house with a surplus before he had time turn on lights the surplus was gonei e prob #,0
3408,So far the candidates are pretty evenly matched..... Wait! The Romney Campaign is letting Mitt speak! Bold move. Advantage Obama. #debate,19.698679,so far the candidates are pretty evenly matched wait the romney campaign is letting mitt speak bold move advantage obama #debate,0
2154,Because the resilience of the American people Obama? Haha we didn't have to do anything...you just gave it to us #presidentialdebate,19.685125,because the resilience of the american people obama haha we didn't have to do anythingyou just gave it to us #presidentialdebate,0
3069,Taking a break and watching the #Debates between #mittens and #Obama. Lets see how this goes.,19.668992,taking a break and watching the #debates between #mittens and #obama lets see how this goes,0
5533,Dear President Obama: You're president. We can't double down on Romney's policies.,19.655422,dear president obama you're president we can't double down on romney's policies,0
2797,#debates 40 million people?  That's 5 million more people than the entire population of Canada,19.655421,#debates million people that's million more people than the entire population of canada,0
3819,RT @tobincommentary: Obama leads off with talk about a recovery but says there's a lot of work to do. We know. #debates,19.65345,obama leads off with talk about a recovery but says there's a lot of work to do we know #debates,0
3954,The President @BarackObama seems in control very calm --  @MittRomney seems very sharp and collected #Debates,19.650358999999998,the president seems in control very calm seems very sharp and collected #debates,0
1744,Mitt Romney: High income people are doing just fine under this economy. #debates,19.629541,mitt romney high income people are doing just fine under this economy #debates,5
2182,Pres. Obama just associated Romney with trickle down economics. Word of the night. #Debates,19.622137,pres obama just associated romney with trickle down economics word of the night #debates,1
3629,President Obama is speaking on jobs and the economy --  who's watching #hot1079watchparty #2012presidentialdebate,19.619003,president obama is speaking on jobs and the economy who's watching #hot1079watchparty #2012presidentialdebate,2
3657,Ooh! The women in CNN's undecided voters pool are slightly up from the men!! This means something! #denverdebate,19.618903,ooh the women in cnn's undecided voters pool are slightly up from the men this means something #denverdebate,0
1643,I'm voting for President Obama because he opened with a joke. Shows how much I know (care) about politics...,19.596367,i'm voting for president obama because he opened with a joke shows how much i know care about politics,0
1794,America does best when the middle class does best! President Obama #PresidentialDebate,19.578489,america does best when the middle class does best president obama #presidentialdebate,0
724,@mosershwag2 Haha --  of course not! I'm so jubilant to advocate the best president ever! President Obama! Haha --  & of course I'm joking,19.572218,haha of course not i'm so jubilant to advocate the best president ever president obama haha of course i'm joking,1
3433,Are either of these presidential candidates answering any of the questions asked? #debates,19.57077,are either of these presidential candidates answering any of the questions asked #debates,0
3022,Score so far: Romney gives opening arguments in a much more relaxed tone than President Obama. #debates,19.555208,score so far romney gives opening arguments in a much more relaxed tone than president obama #debates,0
1526,Romney totally just same-sex-politician-flirted with Obama on his & Michelle's 20th Anniversary. #romantic #mormon #debates,19.552098,romney totally just samesexpoliticianflirted with obama on his michelle's 20th anniversary #romantic #mormon #debates,0
5171,Can't wait until #Syria has its first Presidential #Debates. Would be much more exciting than #DenverDebates.  #FactCheck,19.538373000000004,can't wait until #syria has its first presidential #debates would be much more exciting than #denverdebates #factcheck,0
5196,Jobs: Obama talking a lot without saying anything. Mitt--small business! (yech!) #expandthedebate #denverdebate,19.527212000000006,jobs obama talking a lot without saying anything mittsmall business yech #expandthedebate #denverdebate,0
3688,They're going to get around to fixing the NHL lockout --  right? #Debates,19.519000000000002,they're going to get around to fixing the nhl lockout right #debates,1
4018,Follow the #debates with us here: http://t.co/ITsIRdu0 and tweet us your reactions using #ajstream!,19.508883999999995,follow the #debates with us here and tweet us your reactions using #ajstream,0
3712,Just because you are a good public speaker does not mean you should be President #coughcough #Nobama,19.506159,just because you are a good public speaker does not mean you should be president #coughcough #nobama,2
3674,Not to be racist but black people only like Obama cuz he's black. He is a horrible president #retards,19.503944999999998,not to be racist but black people only like obama cuz he's black he is a horrible president #retards,0
1501,Barack shouts out Michelle and wishes his Sweetie a #happyanniversary to start the debate #PresidentialDebate #loveyaboo,19.501867,barack shouts out michelle and wishes his sweetie a #happyanniversary to start the debate #presidentialdebate #loveyaboo,0
369,Obama continues what he's done for 4 years on the FIRST question: avoid it and change the focus to the past. #RomneyRyan2012,19.484646,obama continues what he's done for years on the first question avoid it and change the focus to the past #romneyryan2012,7
505,Watching this debate to see who's a better bullshitter. Can't deny my sweet spot for my #president #PresidentialDebate,19.478603,watching this debate to see who's a better bullshitter can't deny my sweet spot for my #president #presidentialdebate,0
2006,Mitt Romney begins by offering to have sex with the President as an anniversary president.,19.470447999999998,mitt romney begins by offering to have sex with the president as an anniversary president,1
1813,The only reason why Obama is president is that government wanted a black guy to take the fall. -Bill Burr,19.464256,the only reason why obama is president is that government wanted a black guy to take the fall bill burr,1
4341,This is boring. Where are the dancing girls and the big inflatable dancing thing you see at used car lots #debates,19.461597,this is boring where are the dancing girls and the big inflatable dancing thing you see at used car lots #debates,0
559,Obama passes the 1st test of the night by remembering his wedding anniversary. #debates,19.457368,obama passes the 1st test of the night by remembering his wedding anniversary #debates,0
3645,Good job on making them confront each other. They were kind of dancing around for a bit. #debates,19.445286,good job on making them confront each other they were kind of dancing around for a bit #debates,0
3469,RT @ProfBlackistone: 1980 record #PresidentialDebate audience 80 million bit more than Super Bowl then. Tonight 60 million to watch --  lil ...,19.440218,record #presidentialdebate audience million bit more than super bowl then tonight million to watch lil,13
5597,@MittRomney offered a funny take on President's anniversary - working on raising likeability? #ParishGOV #debates,19.438907,offered a funny take on president's anniversary working on raising likeability #parishgov #debates,0
2293,Both neckties on candidates way too predictable. Boring blue --  retread red #debates,19.419588,both neckties on candidates way too predictable boring blue retread red #debates,0
4377,So if you're from Hawaii then why are you black? OMG Romney --  you can't just ask people why they're black! #Debates,19.405653,so if you're from hawaii then why are you black omg romney you can't just ask people why they're black #debates,0
2205,Alright let's all get ready for some empty promises and mindless pandering #debates,19.402781,alright let's all get ready for some empty promises and mindless pandering #debates,0
5003,RT @YungNilo: WATCHING THIS PRESIDENTIAL DEBATE FOR THE FIRST TIME IN MY LIFE #OBAMA,19.390553,watching this presidential debate for the first time in my life #obama,5
4534,Gary Johnson is a presidential candidate and therefore should be at the #debates The two party system is flawed.,19.381996,gary johnson is a presidential candidate and therefore should be at the #debates the two party system is flawed,0
3817,I hope all you gen y-ers are watching this debate! Critical for our future. #debates,19.360747,i hope all you gen yers are watching this debate critical for our future #debates,2
2221,#Romney just saying what he think the people want to hear... he wasn't saying this about a month ago,19.358622,#romney just saying what he think the people want to hear he wasn't saying this about a month ago,0
4237,@JaeCraycraft well at least romneys going to make it happen. Not just talk about it,19.353669,well at least romneys going to make it happen not just talk about it,0
4681,Hopefully I can survive watching this debate like I survived the gym! #debates,19.352684,hopefully i can survive watching this debate like i survived the gym #debates,0
3238,Romney personal touch on anniversary at opening goes against type casting --  which is the key to the night for him #DenverDebate,19.343973,romney personal touch on anniversary at opening goes against type casting which is the key to the night for him #denverdebate,1
2409,I like what obama says. No wait i like what romney says. Gahhhhh!!! (brain explodes) #presidentialdebate,19.342982,i like what obama says no wait i like what romney says gahhhhh brain explodes #presidentialdebate,0
3625,#Obama dancing around the question! Dont ya love when people don't answer the question directly!,19.337229,#obama dancing around the question dont ya love when people don't answer the question directly,0
2805,C#obama has real jobs on the table --  I was starting to think football unions were the only unions the U.S. cared about.,19.327803000000003,c#obama has real jobs on the table i was starting to think football unions were the only unions the us cared about,0
4674,that's what I'm saying SPECIFICS...Mitt Romney just be like America would do good with more jobs....yes thank you for that,19.322675,that's what i'm saying specificsmitt romney just be like america would do good with more jobsyes thank you for that,1
3004,If you're following the #debates you should really tune into #ajstream --  it's one of few streams not 100% overloaded. Join the conversation!,19.322388,if you're following the #debates you should really tune into #ajstream it's one of few streams not overloaded join the conversation,1
229,The bottom 50% of income earners took in 13% of income and paid less than 3% of federal income taxes. #tcot #p2 #tiot #tlot #Obama2012 #DNC,19.314903,the bottom of income earners took in of income and paid less than of federal income taxes #tcot #p2 #tiot #tlot #obama2012 #dnc,0
1942,If Romney wore bronzer speaking to Latinos would he wear clown makeup talking to a rallying crowd in Texas. *Side eyes* #Debates,19.290948,if romney wore bronzer speaking to latinos would he wear clown makeup talking to a rallying crowd in texas side eyes #debates,0
3852,Obama has good points but have they even been done while he was President? #PresidentialDebate,19.283804999999997,obama has good points but have they even been done while he was president #presidentialdebate,0
1370,Economic patriotism key phrase from Obama --  will come back as an attack on Romney #debates,19.282754,economic patriotism key phrase from obama will come back as an attack on romney #debates,0
3575,Romney's deer-in-headlights look is unmatched perhaps in the history of Presidential #debates,19.279783,romney's deerinheadlights look is unmatched perhaps in the history of presidential #debates,8
1335,We're fact-checking the candidates in real time tonight --  follow along here: http://t.co/c9Ee5FWd #debates,19.25851,we're factchecking the candidates in real time tonight follow along here #debates,4
3788,Lmao snooki ahah RT @snooki: bring it on bitch @laurzins: What do you think Mitt and Barack just said to each other? #PresidentialDebate,19.258217,lmao snooki ahah rt bring it on bitch what do you think mitt and barack just said to each other #presidentialdebate,0
1823,Support Gary Johnson & Libertarian Party to bring the troops home NOW. #GaryJohnsonForPresident @GovGaryJohnson #DenverDebate,19.251314999999998,support gary johnson libertarian party to bring the troops home now #garyjohnsonforpresident #denverdebate,1
4381,Romney uses trickle down to describe Obama's economy plan. Pick better words mitt.,19.238683,romney uses trickle down to describe obama's economy plan pick better words mitt,0
2333,Our clients from Rent-a-Center are major sponsors of Presidential Debate. Dwight & Caron Dumler by the stage #debates http://t.co/h0Xm8vMM,19.219372,our clients from rentacenter are major sponsors of presidential debate dwight caron dumler by the stage #debates,0
3026,Trickle down government is zinger number one from the Romney brain trust. #DenverDebate,19.215408,trickle down government is zinger number one from the romney brain trust #denverdebate,0
4912,Every time I hear obamas voice i think of that call me maybe video of him #debates,19.20351,every time i hear obamas voice i think of that call me maybe video of him #debates,0
2534,Overheard at #Skimm debate party...what do you think you have to do to move #mittromney 's hair #skimmdebate #debate,19.182505000000003,overheard at #skimm debate partywhat do you think you have to do to move #mittromney s hair #skimmdebate #debate,0
3020,Mitt Romney's first rebuttal tonight i guarantee --  yea lets see your birth certificate?,19.175161,mitt romney's first rebuttal tonight i guarantee yea lets see your birth certificate,0
542,If @BarackObama wants to lower the corp #tax rates --  he's had 3 1/2 yrs to get it done. #CantAfford4More #RomneyRyan2012,19.164783,if wants to lower the corp #tax rates he's had yrs to get it done #cantafford4more #romneyryan2012,1
3080,This debate would be better if they were put in an octagon and just had to beat the shit out of each other #PresidentialDebate,19.154747,this debate would be better if they were put in an octagon and just had to beat the shit out of each other #presidentialdebate,4
5131,TURN YOUR TV TO THE DEBATE AND LEARN SOMETHING PPL. FORGET SPORTS TONIGHT.#OBAMA2012,19.153045,turn your tv to the debate and learn something ppl forget sports tonight#obama2012,0
1711,#Obama or #Romney Yall call that a choice. I see more #Wars --  loss of #freedoms and more #poverty in my child's future. #debate VOTE #RONPAUL,19.150550000000003,#obama or #romney yall call that a choice i see more #wars loss of #freedoms and more #poverty in my child's future #debate vote #ronpaul,0
