DocId,Tweet,Score,ProecessedTweet,RetweetCount
1285,Obama answering jobs question by recounting quickly the wreck he inherited. Then pivots to look ahead...looking right at camera #Debates,25.62464,obama answering jobs question by recounting quickly the wreck he inherited then pivots to look aheadlooking right at camera #debates,5
1042,Debates are really just a college theater class final. Who can put on the best show. #DenverDebate,25.624365000000004,debates are really just a college theater class final who can put on the best show #denverdebate,0
3624,#Romney makes a funny that gets better play than #Obama. That it's romantic for the prez to spend his anniversary w/ republican nominee,25.622397,#romney makes a funny that gets better play than #obama that it's romantic for the prez to spend his anniversary w republican nominee,0
5274,Only watching the #debates to see how many times they do the presidential fist with the flat thumb on top,25.612656000000005,only watching the #debates to see how many times they do the presidential fist with the flat thumb on top,0
3247,Thay trickle down is from your party not Potus. RT @ehasselbeck Point #romney : trickle down government won't work. #Debate2012 #debate,25.61224,thay trickle down is from your party not potus rt point #romney trickle down government won't work #debate2012 #debate,0
2256,Jim Lehrer's voice indicates he's a presidential debate moderator --  but his eyes indicate he's the Keymaster of Gozer. #Debate2012 #debates,25.574825,jim lehrer's voice indicates he's a presidential debate moderator but his eyes indicate he's the keymaster of gozer #debate2012 #debates,0
3937,Watching the presidential debate! I already can tell I'm going to be screaming at the tv for the next 2 hours. #passion #politics #obama,25.564780000000003,watching the presidential debate i already can tell i'm going to be screaming at the tv for the next hours #passion #politics #obama,0
3654,Obama talking about Race to the Top and hiring new math and science teachers.  #debates,25.555307999999997,obama talking about race to the top and hiring new math and science teachers #debates,2
2223,Romney's flag pin is bigger than Obama's. This debate --  my friends --  has a winner. #denverdebate,25.521572000000003,romney's flag pin is bigger than obama's this debate my friends has a winner #denverdebate,0
2247,Follow @GovGaryJohnson if you wanna get anything of substance during the debates. 1st vodka/soda is going down quickly. #debates,25.507006,follow if you wanna get anything of substance during the debates 1st vodkasoda is going down quickly #debates,4
5437,Obama starts by saluting First lady on their anniversary! Touts economic patriotism  #latism #debates,25.502587,obama starts by saluting first lady on their anniversary touts economic patriotism #latism #debates,0
2045,Comenzo el debate Presidencial entre Mitt Romney y Barack Obama. Queremos saber su opinion de lo que ambos vayan... http://t.co/FjrJqYHM,25.501272000000004,comenzo el debate presidencial entre mitt romney y barack obama queremos saber su opinion de lo que ambos vayan,0
3215,Obama's Race to The Top was the best thing to happen to education in decades. #Debates,25.499873,obama's race to the top was the best thing to happen to education in decades #debates,0
4404,every time there is a presidential debate I get so excited #lel #spee #debates,25.491871,every time there is a presidential debate i get so excited #lel #spee #debates,0
2598,Fact: U.S. unemployment rate stands at 8.1% as of August.  Approximately 12.5 million people are out of work. http://t.co/ggsf06ln #debates,25.435146,fact us unemployment rate stands at as of august approximately million people are out of work #debates,4
3127,First q: What are most important differences between 2 of you on jobs? Obama: Happy anniversary --  sweetie! #DenverDebate,25.433069000000003,first q what are most important differences between of you on jobs obama happy anniversary sweetie #denverdebate,133
2771,RT @joshlevscnn: Blue tie --  red tie. In case you forget who's on which side. #cnndebate #debates,25.40575,blue tie red tie in case you forget who's on which side #cnndebate #debates,5
5187,Obama: hire more teachers and keep tuition low --  creating more spots in community colleges. #debates (via @arbiteronline ),25.404321,obama hire more teachers and keep tuition low creating more spots in community colleges #debates via,0
1466,President Obama --  directly answer gov romneys comment about trickle down we'll let me just say --  hot dogs are delicious #ducknmove,25.402298999999996,president obama directly answer gov romneys comment about trickle down we'll let me just say hot dogs are delicious #ducknmove,0
59,Interesting --  relatable(?) start for the president --  discusses anniversary with Mrs. Hmmm. #Debates #voteRIT,25.393153999999996,interesting relatable start for the president discusses anniversary with mrs hmmm #debates #voterit,0
277,Obama is the only president that makes me WANT to watch a presidential debate.,25.366722,obama is the only president that makes me want to watch a presidential debate,0
4058,President Obama will be hitting Mitt with the Nigga Please and What Hell You Just Say looks tonight!! #Guaranteed,25.359809999999996,president obama will be hitting mitt with the nigga please and what hell you just say looks tonight #guaranteed,3
608,US presidential debate between Mitt Romney and Barack Obama starts. Live video: http://t.co/PJ7IIhQI #obama #romney,25.35932,us presidential debate between mitt romney and barack obama starts live video #obama #romney,0
1009,Okay Obama --  stop talking around the question. How are you gonna create jobs????? #debates,25.342665,okay obama stop talking around the question how are you gonna create jobs #debates,0
4078,President is babbling about his anniversary --  Romney is getting to the point with his 5 points. Although cute --  Obama is just rhetoric so far.,25.323441999999996,president is babbling about his anniversary romney is getting to the point with his points although cute obama is just rhetoric so far,0
5336,Mitt Romney wishes President & 1st Lady Obama a happy wedding anniversary. #debate,25.302491,mitt romney wishes president 1st lady obama a happy wedding anniversary #debate,0
189,People hate mitt Romney based off of twitter... how about actually watching the debate and learning something.,25.302075000000002,people hate mitt romney based off of twitter how about actually watching the debate and learning something,0
1998,Trickle down?! TRICKLE DOWN?! TRICKLE DOWN ON MY ASS MITT -what I would say if I was president #Debates,25.28141,trickle down trickle down trickle down on my ass mitt what i would say if i was president #debates,0
3169,I m sure this was the most romantic place to celebrate your 20th anniversary --  here with me! jokes Romney #afpusa2012 #debates,25.238733,i m sure this was the most romantic place to celebrate your 20th anniversary here with me jokes romney #afpusa2012 #debates,0
459,There's something about Romney's eyes that scare the shit out of me. Obama's eyes are kind and welcoming. #Obama2012,25.233075,there's something about romney's eyes that scare the shit out of me obama's eyes are kind and welcoming #obama2012,0
1343,Not sure how I feel about the whole  making no noise rule for the debate. Why have an audience at all? #debates,25.201231,not sure how i feel about the whole making no noise rule for the debate why have an audience at all #debates,0
5331,Did Pres Obama really start off the debate with his anniversary? #debates,25.19202,did pres obama really start off the debate with his anniversary #debates,0
5201,RT @BreakingNews: Live video --  chat: President Obama --  Republican nominee Mitt Romney square off in the 1st presidential debate - @NBCNews ...,25.167936,live video chat president obama republican nominee mitt romney square off in the 1st presidential debate,101
4614,Really --  the corporate tax rate is too high? Single mothers pay more in taxes than @GE http://t.co/0wlg0AW0 #denverdebate #debates,25.164257,really the corporate tax rate is too high single mothers pay more in taxes than #denverdebate #debates,1
3534,Speaker: What will you do about Jobs? President Obama: FIRST OFF --  SHOUTS OUT TO MICHELLE ;) I SEE YOU BABY,25.159518,speaker what will you do about jobs president obama first off shouts out to michelle i see you baby,1
4732,The POTUS looks Presidential ... The Challenger looks nervous ... and like he stank ... #debates,25.156334,the potus looks presidential the challenger looks nervous and like he stank #debates,0
5135,RT @kristenhinkle14: Ladies and Gents --  it is now time for the Presidential Debate! I wish the best of luck to Mitt Romney! #DenverDebate ...,25.129385000000003,ladies and gents it is now time for the presidential debate i wish the best of luck to mitt romney #denverdebate,2
3442,obama --  you are just a wonderful president. you've done so many great things for america. LOL JK.,25.106938,obama you are just a wonderful president you've done so many great things for america lol jk,0
1510,@VirginiaProdan - good start Mitt Romney - details info on what and how to help us and America!  No good OB! Clear Capitalism vs Socialism !,25.093822000000003,good start mitt romney details info on what and how to help us and america no good ob clear capitalism vs socialism,0
3074,#debates watching the debates. So far I like the format. Gotta love Jim Lehrer--he adds such sophistication to the occasion.,25.088337,#debates watching the debates so far i like the format gotta love jim lehrerhe adds such sophistication to the occasion,0
5372,Mitt is looking less pumpkin-esque. This is the one month when it's acceptable to look like a gourd #debates,25.04823,mitt is looking less pumpkinesque this is the one month when it's acceptable to look like a gourd #debates,0
5034,Watching the #Debates. Already hoping they'll answer the questions asked with real results and specifics.,25.016805999999995,watching the #debates already hoping they'll answer the questions asked with real results and specifics,0
228,I'd like to thank @nprnews for discussing the pivoting debate tactic. I will definitely be looking out for it tonight. #debates,25.009862,i'd like to thank for discussing the pivoting debate tactic i will definitely be looking out for it tonight #debates,0
3309,Lets Go Obama !! FIGHT FOR TEENS TRYING TO GET AN EDUCATION !!! #Debates,24.988723,lets go obama fight for teens trying to get an education #debates,0
4995,@Cosmopolitan jobs are definitely important to me. im graduating soon and would like to enter a strong job market. #debates,24.984381,jobs are definitely important to me im graduating soon and would like to enter a strong job market #debates,0
1338,Happy 20th Anniversary To My President and 1st Lady Obama. Still 9 years behind my parents.Know they will ha http://t.co/wruRn5sr,24.978097,happy 20th anniversary to my president and 1st lady obama still years behind my parentsknow they will ha,0
3781,Mitt going with relatable approach right off the bat--- speaking as a fellow citizen. good move. #debates #theblazetv,24.977183,mitt going with relatable approach right off the bat speaking as a fellow citizen good move #debates #theblazetv,0
2590,Both of them better say something different from the bull they've said for the past weeks this is the game changer right here #Decision2012,24.975322000000002,both of them better say something different from the bull they've said for the past weeks this is the game changer right here #decision2012,0
1771,@AlexSchriver: In Obama's rebuttal about trickle-down --  he failed to say the words trickle-down. Gonna be a fun night. #crnc Amen. #tcot,24.969794,in obama's rebuttal about trickledown he failed to say the words trickledown gonna be a fun night #crnc amen #tcot,0
703,#debates  The Democratic platform is not to help the lower middle class --  but to keep them dependent on gov. programs to keep power,24.966057,#debates the democratic platform is not to help the lower middle class but to keep them dependent on gov programs to keep power,0
1721,Obama talks about improving the education system - which is one of his biggest sources of campaign funding http://t.co/ueQLPlZ8 #debates,24.952771000000002,obama talks about improving the education system which is one of his biggest sources of campaign funding #debates,3
1657,Romney is already hitting on talking points..... Trickle down government vs trickle down economics #debates,24.944295999999994,romney is already hitting on talking points trickle down government vs trickle down economics #debates,1
2373,Fresco's Gist:::: Barack And Michelle Obama On Their 20 Years Of Marriage:   Today is President Obama's and... http://t.co/KvFj9fqR,24.927397000000003,fresco's gist barack and michelle obama on their years of marriage today is president obama's and,0
4264,Youngest's Update::: Barack And Michelle Obama On Their 20 Years Of Marriage:   Today is President Obama's ... http://t.co/Wm6fBaUc,24.927397000000003,youngest's update barack and michelle obama on their years of marriage today is president obama's,0
2528,#debates Race to the top? Top of WHAT?!? Our current DUNG HEAP?!?!? Great offer BO. Green energy? Proven WASTE of taxpayer money! #Cronyism,24.922733,#debates race to the top top of what our current dung heap great offer bo green energy proven waste of taxpayer money #cronyism,0
218,How are you going to hire those teachers? How are you go open slots? Keep tuition low? #DenverDebate,24.898996,how are you going to hire those teachers how are you go open slots keep tuition low #denverdebate,3
5231,RT @factcheckdotorg: We will be live tweeting during the first presidential debate in Colorado tonight. #denverdebate http://t.co/ywOkvvlU,24.878092,we will be live tweeting during the first presidential debate in colorado tonight #denverdebate,59
3122,President Obama wants to hire more math and science teachers. Who wants to go back to the Cold War again?,24.87448,president obama wants to hire more math and science teachers who wants to go back to the cold war again,1
3281,Obama should be home celebrating his 20th w Michelle. Instead he's standing on stage debating an empty suit. #debates #DebateWatch,24.855744,obama should be home celebrating his 20th w michelle instead he's standing on stage debating an empty suit #debates #debatewatch,5
2227,President Obama is so cute for wishing Michelle a happy anniversary! #presidentialdebate,24.853358,president obama is so cute for wishing michelle a happy anniversary #presidentialdebate,0
1444,Romney: I was in Dayton --  OH last week where I met a man named Bob who makes a living writing 250 songs a week. #debates,24.838760999999998,romney i was in dayton oh last week where i met a man named bob who makes a living writing songs a week #debates,6
1858,Predictably --  opening statements already see Mitt telling his points --  while Obama makes attack on Romney & promises economic patriotism,24.828914000000005,predictably opening statements already see mitt telling his points while obama makes attack on romney promises economic patriotism,0
2844,I'm glad the first question at the #debates was about Obama's anniversary.,24.818736,i'm glad the first question at the #debates was about obama's anniversary,0
2698,onight is Barack and Michelle's 20th wedding anniversary. what a way to celebrate! #debates #NDAAruling,24.815810999999997,onight is barack and michelle's 20th wedding anniversary what a way to celebrate #debates #ndaaruling,0
4351,Damn I agree with what #romney says. That's my homeboy. Let's keep the money we MAKE and not just GIVE it away to the poor just because.,24.805218999999997,damn i agree with what #romney says that's my homeboy let's keep the money we make and not just give it away to the poor just because,0
1594,A true gentleman! RT @HuffPostPol: Obama starts off by wishing Michelle a happy anniversary http://t.co/lnfJ8WJQ #debates,24.800487999999998,a true gentleman rt obama starts off by wishing michelle a happy anniversary #debates,0
3929,Obama is smart . He Started off talking about his wife so all the woman watching will say aww and like him more,24.796184,obama is smart he started off talking about his wife so all the woman watching will say aww and like him more,1
4708,@MittRomney looks like the next President of the United States.  Rt if you agree.  #Debates,24.78897,looks like the next president of the united states rt if you agree #debates,3
5227,#Obama2012 my president makes me a proud American --  i just do not agree with the political views of Gov. Romney.,24.782550999999998,#obama2012 my president makes me a proud american i just do not agree with the political views of gov romney,3
230,telling your wife happy anniversary in front of basically the entire country #itsreal #obama2012,24.776324,telling your wife happy anniversary in front of basically the entire country #itsreal #obama2012,0
5138,Watching the debate .. I really want Obama to win I got faith in my president !!!!!,24.776024,watching the debate i really want obama to win i got faith in my president,6
4872,Time to watch this Presidential Debate. Mr.Kennedy has taught me this last year. Lol. #Republican or #Democrat ?!?,24.763223,time to watch this presidential debate mrkennedy has taught me this last year lol #republican or #democrat,0
3416,Obama playing the friend-to-the-business tax card by saying he too favors lower corporate tax rate #debates,24.760834,obama playing the friendtothebusiness tax card by saying he too favors lower corporate tax rate #debates,0
1053,RT @Mr_GotoGuy I see President Obama puts his wife 1st u sorry ass men could learn a few things #watchingthedabate,24.757849000000004,i see president obama puts his wife 1st u sorry ass men could learn a few things #watchingthedabate,1
1581,Love that Presdient Obama acknowledged his wife and their anniversary in his side of the #debates that's a good husband!,24.756788,love that presdient obama acknowledged his wife and their anniversary in his side of the #debates that's a good husband,1
2132,Mitt Romney has realised that putting ideas in a list format makes you look like you know your shit #debate,24.752571,mitt romney has realised that putting ideas in a list format makes you look like you know your shit #debate,0
2272,Romney says the debate provides Obama to have the most romantic wedding anniversary ever. Niceee! #Debates,24.739461,romney says the debate provides obama to have the most romantic wedding anniversary ever niceee #debates,0
2939,@ProducerMatthew: Barack Obama: We all know that we've still got a lot of work to do. #debates yep so vote Obama!,24.733272999999997,barack obama we all know that we've still got a lot of work to do #debates yep so vote obama,0
2793,Love the anniversary shoutouts! Im ready to see some action in america! #debates,24.730902999999998,love the anniversary shoutouts im ready to see some action in america #debates,0
3017,#debates America does best when the middle class does best. Well said @BarackObama,24.725455,#debates america does best when the middle class does best well said,0
234,#presidentialdebate   #nobama opens up with best thing ever marrying his wife 20 years ago . So lame this country needs help,24.720734,#presidentialdebate #nobama opens up with best thing ever marrying his wife years ago so lame this country needs help,0
3552,Obama: hire 100k STEM teachers --  create comm college slots; good news for #millennials if true #debates #roorxn,24.710665000000002,obama hire 100k stem teachers create comm college slots good news for #millennials if true #debates #roorxn,0
3283,Romney tells stories of people he met campaigning --  whose stories sound suspiciously like Will Smith in Pursuit of Happyness #debates,24.673996,romney tells stories of people he met campaigning whose stories sound suspiciously like will smith in pursuit of happyness #debates,6
276,@iamwill  i say romney tried to get us too emotional from the beginning. wrong. #debates,24.673016999999998,i say romney tried to get us too emotional from the beginning wrong #debates,0
131,You better wish your boo HAPPY ANNIVERSARY before you answer the question! #PresidentialDebate2012 #obama2012,24.666866,you better wish your boo happy anniversary before you answer the question #presidentialdebate2012 #obama2012,0
248,BHO gives MO anniversary greetings. Opens #PresidentialDebate  pointing to economic improvement. Gets in dig on Romney's approach to economy,24.660208000000004,bho gives mo anniversary greetings opens #presidentialdebate pointing to economic improvement gets in dig on romney's approach to economy,0
3364,Obama ta medio cagado --  el otro se pint de negro para intimidar y aadirle barrio a esa jeta de oligarca republicano. Buen tipo. #debates,24.652455,obama ta medio cagado el otro se pint de negro para intimidar y aadirle barrio a esa jeta de oligarca republicano buen tipo #debates,0
5369,obama wants to keep tuition low?! he looking out for us college kids!!! #obama2012,24.627862999999998,obama wants to keep tuition low he looking out for us college kids #obama2012,0
2596,The CO undecided voter approval tracker on CNN is an interesting touch can we get a shot of the focus group? #Debate #Election2012,24.609693,the co undecided voter approval tracker on cnn is an interesting touch can we get a shot of the focus group #debate #election2012,0
2784,What! Really don't give a shit about his anniversary. Answer the fucking question. #DenverDebate,24.5673,what really don't give a shit about his anniversary answer the fucking question #denverdebate,0
4514,If you are still undecided please watch the #Debates tonight! This is more important than Mean Girls quotes yeah.,24.561590000000002,if you are still undecided please watch the #debates tonight this is more important than mean girls quotes yeah,0
4274,you're right Barry --  next year you'll be celebrating in Chicago --  far away from the Romney White House #tcot #debates #romneyryan2012,24.553354999999996,you're right barry next year you'll be celebrating in chicago far away from the romney white house #tcot #debates #romneyryan2012,0
1018,Romney keep talking about education but you gone take pell grant. How is that going to help. #PresidentialDebate,24.550788,romney keep talking about education but you gone take pell grant how is that going to help #presidentialdebate,0
2525,RT @OccupyWallSt: First question --  candidates: Please disclose your top campaign contributors and then tell us what you have promised in ...,24.545312,first question candidates please disclose your top campaign contributors and then tell us what you have promised in,420
730,Oh yah #Obama---you want to hire all those new teachers --  cause the public school system has done so well!!!,24.508392,oh yah #obamayou want to hire all those new teachers cause the public school system has done so well,0
5302,Obama with a wide blue tie. opens with anniversary wishes to Michelle. #debates,24.497049999999998,obama with a wide blue tie opens with anniversary wishes to michelle #debates,4
3054,I like Obama's voice --  and Mitt Romney's tie... I might care more when I can vote.,24.495440000000002,i like obama's voice and mitt romney's tie i might care more when i can vote,1
5050,Watching the #debates? Tweet with us while bring you info from @factcheckdotorg and @MTVPowerOf12. What do you hope the candidates cover?,24.494428999999997,watching the #debates tweet with us while bring you info from and what do you hope the candidates cover,19
4151,President Obama @BarackObama begins the nite wishing his wife of 20 yrs @MichelleObama Happy Anniversary. #FamilyFirst,24.483600000000003,president obama begins the nite wishing his wife of yrs happy anniversary #familyfirst,0
82,Changed my mind. Now live tweeting this Full House episode. Uncle Joey Just pulled a classic cut it out! haha! #PresidentialDebate what?,24.46636,changed my mind now live tweeting this full house episode uncle joey just pulled a classic cut it out haha #presidentialdebate what,0
860,Use Spin It to create your own lines from the presidential #debates. And then use #MySpin to share it with us: http://t.co/0skBdJVT,24.439504999999997,use spin it to create your own lines from the presidential #debates and then use #myspin to share it with us,2
5263,Mitt --  wearing a bigger American flag pin doesn't make you a good politician #2012debates #Obama2012,24.437213999999997,mitt wearing a bigger american flag pin doesn't make you a good politician #2012debates #obama2012,0
3366,#debates  The American people is interviewing Candidates for the following position: President of USA.,24.428691,#debates the american people is interviewing candidates for the following position president of usa,0
23,Barack giving a shoutout to his wife before anything. Thats love #debates,24.399607,barack giving a shoutout to his wife before anything thats love #debates,2
2140,FYI: Expanding Pell Grants and credit softening for education loans do not keep tuition low. #debates,24.38262,fyi expanding pell grants and credit softening for education loans do not keep tuition low #debates,0
953,FACT: Romney/Ryan would cut Pell Grant scholarships for nearly 10 million students even as they give tax cuts to wealthy. #Debate2012,24.379540000000002,fact romneyryan would cut pell grant scholarships for nearly million students even as they give tax cuts to wealthy #debate2012,0
3249,Don't think many women would complain if their husband had to do a #POTUS #debates on their anniversary --  just syaing #belatino,24.373766,don't think many women would complain if their husband had to do a #potus #debates on their anniversary just syaing #belatino,0
