DocId,Tweet,Score,ProecessedTweet,RetweetCount
2553,Obama goes first as U.S. presidential debate opens with Obama saying happy anniversary to wife. Full coverage. #debates http://t.co/zahpO8NU,44.9629,obama goes first as us presidential debate opens with obama saying happy anniversary to wife full coverage #debates,1
1567,#obama touts race to the top as one way to improve economy.  wants to keep tuition low. lower corporate tax rates and close loops.  #debate,43.864401,#obama touts race to the top as one way to improve economy wants to keep tuition low lower corporate tax rates and close loops #debate,0
905,Romney's wearing a red tie and Obama's wearing a blue one --  OH I SEE WHAT YOU GUYS DID THERE #debates,43.354669,romney's wearing a red tie and obama's wearing a blue one oh i see what you guys did there #debates,0
2318,Romney's 5-point plan 1. Create jobs 2. Increase take home pay 3. Make everyone happy 4. World peace 5. Galactic domination #debates,43.33891499999999,romney's point plan create jobs increase take home pay make everyone happy world peace galactic domination #debates,1
386,Happy 20th anniversary Barack & Michelle!!! I love how he told her happy anniversary before he even began his speech !! #PresidentialDebate,42.889088,happy 20th anniversary barack michelle i love how he told her happy anniversary before he even began his speech #presidentialdebate,2
1987,By wishing his wife a happy anniversary to kick off the debate --  President Obama gained himself one job tonight.,42.720813,by wishing his wife a happy anniversary to kick off the debate president obama gained himself one job tonight,23
1935,I'm watching o/ RT: @BarackObama: Watch live: President Obama discusses his specific plans to keep us moving forward in the first president,42.506719,i'm watching o rt watch live president obama discusses his specific plans to keep us moving forward in the first president,0
572,First Presidential Debate.  Love how @BarackObama wishes his wife a happy anniversary first thing.  #Debates,41.953762000000005,first presidential debate love how wishes his wife a happy anniversary first thing #debates,0
5383,Obama --  when asked about jobs and the economy: Happy anniversary --  Michelle. Good point there --  Mr. President. #debate2012,41.057385,obama when asked about jobs and the economy happy anniversary michelle good point there mr president #debate2012,0
1412,Romney is talking about people asking him for help finding a job. How many jobs did he create with the tax cuts Bush gave him? #debates,41.018212000000005,romney is talking about people asking him for help finding a job how many jobs did he create with the tax cuts bush gave him #debates,8
394,@BarackObama: Watch live: President Obama discusses his specific plans to keep us moving forward in the first presidential debate.,40.648619999999994,watch live president obama discusses his specific plans to keep us moving forward in the first presidential debate,0
2681,RT @BarackObama: Watch live: President Obama discusses his specific plans to keep us moving forward in the first presidential debate. ht ...,40.648619999999994,watch live president obama discusses his specific plans to keep us moving forward in the first presidential debate ht,1102
1062,President spent first minute and a half not answering first question. Spent next half a minute giving non specifics to question. #debates,40.332078,president spent first minute and a half not answering first question spent next half a minute giving non specifics to question #debates,0
1433,Question: What is the diff between you two on creating jobs? Pres. Obama gets first answer. But he says happy anniversary to FLOTUS #Debates,40.15434,question what is the diff between you two on creating jobs pres obama gets first answer but he says happy anniversary to flotus #debates,5
2685,Oh you asked me a direct question? I'm going to answer something I want to talk about <-- presidential debate on both sides #debates,39.907184,oh you asked me a direct question i'm going to answer something i want to talk about presidential debate on both sides #debates,0
3261,Oh I get it --  Obama looks at Education as Make Work. Something tells me that Quality and Actual Learning isn't in that plan. #DenverDebate,39.378834999999995,oh i get it obama looks at education as make work something tells me that quality and actual learning isn't in that plan #denverdebate,0
3912,I love a man who can fit an anniversary shout-out to his wife in the slim time he has to make his point during a public debate. #debates,39.205172999999995,i love a man who can fit an anniversary shoutout to his wife in the slim time he has to make his point during a public debate #debates,0
4290,RT @BarackObama: Debate prep: Make sure your friends know President Obamas plan to keep us moving forward. http://t.co/vhSrCTrs --  http:/ ...,39.01467899999999,debate prep make sure your friends know president obamas plan to keep us moving forward http,1291
1638,I like that one is wearing a red tie & the other is wearing blue--would hate to seem like they agree on tie color  #denverdebate #debatefest,38.973719,i like that one is wearing a red tie the other is wearing bluewould hate to seem like they agree on tie color #denverdebate #debatefest,0
167,I know I'm live-tweeting but I don't really want to see live tweets popping up on this live debate I'm watching as well. #debates,38.724457,i know i'm livetweeting but i don't really want to see live tweets popping up on this live debate i'm watching as well #debates,0
1844,Obama's blue tie really brings out his soul. Romney's red tie really brings out his horns. #blatantpartisan #debates,38.688541,obama's blue tie really brings out his soul romney's red tie really brings out his horns #blatantpartisan #debates,0
2666,@tweetTV: #debates get social w/ @tweetTV! See & filter all of the tweets about the debate --  get political fact checks and more! http://t ...,38.656240999999994,#debates get social w see filter all of the tweets about the debate get political fact checks and more,0
2617,Happy anniversary President Obama and Michelle Obama. I want a love like that. With 40 million people watching it.,38.644014000000006,happy anniversary president obama and michelle obama i want a love like that with million people watching it,0
2469,#debates He asked you about jobs and you chose to make the moment about you and your anniversary! I'm done with you! Get out now!,38.571269,#debates he asked you about jobs and you chose to make the moment about you and your anniversary i'm done with you get out now,0
2447,Now kids --  in case you're confused --  the Republican is the one in the RED tie --  and the Democrat is wearing a BLUE tie. #debates #fb,38.550706000000005,now kids in case you're confused the republican is the one in the red tie and the democrat is wearing a blue tie #debates #fb,0
3745,Education in Obama's wheelhouse --  I really want to know if Romney counters w/ something different #ElectionClass #Debates,38.374863,education in obama's wheelhouse i really want to know if romney counters w something different #electionclass #debates,0
1073,I know that's right --  President Obama just gave his wife a shout out and wished her a Happy Anniversary before he addressed anything else.,38.349821999999996,i know that's right president obama just gave his wife a shout out and wished her a happy anniversary before he addressed anything else,0
4035,Live right now on NewsRadio 95 WXTK: The first presidential debate between President Barack Obama and Republican challenger Mitt Romney.,38.251899,live right now on newsradio wxtk the first presidential debate between president barack obama and republican challenger mitt romney,0
1665,Obama says he wants to hire 100 -- 000 new teachers. Can we get some non-government jobs please? #debates #tcot,38.216142999999995,obama says he wants to hire new teachers can we get some nongovernment jobs please #debates #tcot,1
3173,#debates using the Bill Clinton 1st 2nd 3rd method of answering makes it easy on people to find the meat. Good job Mr President.,38.066106000000005,#debates using the bill clinton 1st 2nd 3rd method of answering makes it easy on people to find the meat good job mr president,0
3076,Didn't like Obama's start still has answered question I don't care if it's his anniversary! Babbling now #tcot #Obama #debate,38.007654,didn't like obama's start still has answered question i don't care if it's his anniversary babbling now #tcot #obama #debate,0
653,Watching US presidential debate. I really wanted to see @RonPaul debate with Obama.. would've been entertaining. #debates,37.866693000000005,watching us presidential debate i really wanted to see debate with obama would've been entertaining #debates,0
2932,Barack has a blue tie and Mitt's tie is red. This is to reinforce party ID among low information voters & forgetful heavy drinkers. #debates,37.683018,barack has a blue tie and mitt's tie is red this is to reinforce party id among low information voters forgetful heavy drinkers #debates,1
3890,@fakedansavage: Could everyone agree on one hashtag --  please? I'm seeing #debate #debate #denverdebate I like mine the best! Lol,37.493097,could everyone agree on one hashtag please i'm seeing #debate #debate #denverdebate i like mine the best lol,0
2295,Hunkered down to watch the US Presidential Debate. Lets see if they talk about real issues. #Debates,37.318119,hunkered down to watch the us presidential debate lets see if they talk about real issues #debates,0
3286,President Obama kicks off debate by ignoring the jobs question and wishing Michelle a Happy Anniversary,37.280977,president obama kicks off debate by ignoring the jobs question and wishing michelle a happy anniversary,5
2410,#Obama needs to stop using his wife as a crutch. Wishing his wife a happy anniversary is on stage is not very presidential #debate,37.253606,#obama needs to stop using his wife as a crutch wishing his wife a happy anniversary is on stage is not very presidential #debate,0
2945,First --  let me start my debate commentary by saying that Mitt Romney's tie is one of the worst ties that I have ever seen,37.24158799999999,first let me start my debate commentary by saying that mitt romney's tie is one of the worst ties that i have ever seen,0
3658,No ass right now for Obama on his anniversary he debating #obama2012 #support #obama2012 #obama2012 #support #obama2012 #obama2012,37.14855299999999,no ass right now for obama on his anniversary he debating #obama2012 #support #obama2012 #obama2012 #support #obama2012 #obama2012,0
1748,Romney's wearing a red tie and Obama's wearing a blue --  OH I SEE WHAT YOU GUYS DID THERE #debates,37.121537000000004,romney's wearing a red tie and obama's wearing a blue oh i see what you guys did there #debates,0
468,Can't get a job if you don't know how to do the work. Education investment is the biggest jobs program out there #debates,36.80694,can't get a job if you don't know how to do the work education investment is the biggest jobs program out there #debates,0
836,Watching the debate @MichelleObama @BarackObama Vote #2012 Happy 20th Anniversary President Obama and First Lady Michelle,36.765930999999995,watching the debate vote # happy 20th anniversary president obama and first lady michelle,0
932,President Barack Obama started his debate by telling his wife Michelle Happy Anniversary...S/O to him for putting her 1st! True Love,36.74296700000001,president barack obama started his debate by telling his wife michelle happy anniversaryso to him for putting her 1st true love,0
4815,Love a good debate --  especially with my president has the good sense to give props to his wife. #debates,36.684705,love a good debate especially with my president has the good sense to give props to his wife #debates,0
2180,#Debates - Hire more math and science teachers --  not just improve education good for you Mr. President.,36.563555,#debates hire more math and science teachers not just improve education good for you mr president,0
1562,Romney:Congratulations on your anniversary Mr. President --  now please allow me to shit on everything you've done over the last 4 yrs #debates,36.558792,romneycongratulations on your anniversary mr president now please allow me to shit on everything you've done over the last yrs #debates,0
4685,Barack Obama: I want to make sure that we keep tuition low for our young people. #debates,36.389267,barack obama i want to make sure that we keep tuition low for our young people #debates,9
1598,The American people want you to tell us about our economy... Not your wedding anniversary! #debates #2012debate #denverdebate,36.387981,the american people want you to tell us about our economy not your wedding anniversary #debates #2012debate #denverdebate,0
5398,Are you watching the Presidential #debates between President @BarackObama & Gov @MittRomney? Feel free to let us know your thoughts!,36.376363999999995,are you watching the presidential #debates between president gov feel free to let us know your thoughts,1
882,@spoor77 shure --  but the undecided people want to know what he's going to do to help with jobs.. not about his anniversary... #debates #g442,36.255509,shure but the undecided people want to know what he's going to do to help with jobs not about his anniversary #debates #g442,0
4368,Romney's American flag pin is bigger than President Obama's. That must mean he's more American --  right? #DenverDebate,36.250485,romney's american flag pin is bigger than president obama's that must mean he's more american right #denverdebate,0
2834,Asked about jobs --  Obama diverts to 20th anniversary 1st --  then dives in. Autos are back; change tax code --  reduce deficit. #debates,36.217639999999996,asked about jobs obama diverts to 20th anniversary 1st then dives in autos are back change tax code reduce deficit #debates,0
2909,Mitt actually knows how to create real jobs. Obama is on track to be the first post-WW POTUS to see actual loss of net jobs. #DenverDebate,36.156116,mitt actually knows how to create real jobs obama is on track to be the first postww potus to see actual loss of net jobs #denverdebate,6
3825,Back to Obama --  response: Race to the Top has prompted reforms in 46 states... now I want to hire 100K new teachers #debates #denverdebate,36.09846,back to obama response race to the top has prompted reforms in states now i want to hire 100k new teachers #debates #denverdebate,0
4688,Obama is such a good husband he made sure he told his wife Happy Anniversary before he said anything. #teamObama,35.713706,obama is such a good husband he made sure he told his wife happy anniversary before he said anything #teamobama,0
3488,RT @BarackObama: Tune in here at 9pm ET to watch President Obama in tonights debate --  and get the facts you need to get his back: http:/ ...,35.691103000000005,tune in here at et to watch president obama in tonights debate and get the facts you need to get his back http,1501
3621,President Obama: I want to make sure that we keep tuition low for our young people. #truth #debate,35.598685999999994,president obama i want to make sure that we keep tuition low for our young people #truth #debate,2
842,@BarackObama: Watch live: President Obama discusses his specific plans to keep us moving forward... RT ... By lying his ass off. #tcot,35.591029999999996,watch live president obama discusses his specific plans to keep us moving forward rt by lying his ass off #tcot,0
388,Lehrer: Mr. President --  please respond directly to Romney's remark about trickle down govt. Obama just repeats his first answer. #Debate,35.564483,lehrer mr president please respond directly to romney's remark about trickle down govt obama just repeats his first answer #debate,6
1863,#Debates - You were supposed to tell us all this on the 1st question round....NOT wish your wife happy anniversary!,35.498933,#debates you were supposed to tell us all this on the 1st question roundnot wish your wife happy anniversary,0
3183,Question #1 - President Obama on jobs; It's Bush's fault. Happy Anniversary Michelle --  Vegas... here we come. #Debate2012,35.480649,question # president obama on jobs it's bush's fault happy anniversary michelle vegas here we come #debate2012,0
3229,C'mon Barack --  you already wished her happy anniversary on Twitter. Just slay Romney and instill live in all of us. #PresidentialDebate,35.471078000000006,c'mon barack you already wished her happy anniversary on twitter just slay romney and instill live in all of us #presidentialdebate,1
2089,President Barack Obama and presidential candidate Romney have entered. President Obama is addressing jobs. #debates http://t.co/ITcbeG9e,35.466844,president barack obama and presidential candidate romney have entered president obama is addressing jobs #debates,2
2317,Obama: We've got to improve our #education system...make sure we keep tuition low for our young people #debate #debate2012 #denverdebate,35.457739999999994,obama we've got to improve our #education systemmake sure we keep tuition low for our young people #debate #debate2012 #denverdebate,0
5172,Wishing ur wife Happy Anniversary at the start of ur #debate speech.... Aww :) #Winning #Obama2012,35.352385,wishing ur wife happy anniversary at the start of ur #debate speech aww #winning #obama2012,0
3957,Romney: High income people are doing just fine in this economy. Theyll do just fine whether your president or I'm president. #debates,35.340358,romney high income people are doing just fine in this economy theyll do just fine whether your president or i'm president #debates,0
1331,Happy 20th anniversary to my parents; our President and the first lady Barack and Michelle Obama ! :) i love yall,35.324966999999994,happy 20th anniversary to my parents our president and the first lady barack and michelle obama i love yall,0
5268,Nice that @MittRomney wore a red tie and @BarackObama wore a blue tie.  Someone should of worn a purple tie to shake things up. #debates,35.22342400000001,nice that wore a red tie and wore a blue tie someone should of worn a purple tie to shake things up #debates,0
1074,Pres. @BarackObama  just took the stage. Ready for a GREAT #debates. Starting off on the economy. HAPPY ANNIVERSARY to him & @MichelleObama.,35.083082,pres just took the stage ready for a great #debates starting off on the economy happy anniversary to him,0
4774,.@MittRomney now takes his turn on economy. Anecdotes about people out of work. Will take a different path --  Romney says. #debates,34.958121,now takes his turn on economy anecdotes about people out of work will take a different path romney says #debates,0
1252,#Romney's most romantic place joke was the first time he actually said something that made me laugh. Good start.,34.952484999999996,#romney's most romantic place joke was the first time he actually said something that made me laugh good start,0
1211,Mr. President --  wishing your wife a happy anniversary does not make me like you. #nobama,34.93455,mr president wishing your wife a happy anniversary does not make me like you #nobama,0
2551,And of course Obama has a blue tie and Romney a red one. Romney has stripes --  Obama's tie is solid. #crosscuttingcleavages  #debates,34.927546,and of course obama has a blue tie and romney a red one romney has stripes obama's tie is solid #crosscuttingcleavages #debates,0
2873,Wonder if they were going for intended semiotics with Obama's blue tie & Romney's red tie. #Debates,34.880916,wonder if they were going for intended semiotics with obama's blue tie romney's red tie #debates,0
906,@TinTower @johnpeart Stop tweeting me for one night and watch Obama get owned live: http://t.co/4xSQqTxN #Debates #PresidentialDebate,34.860147000000005,stop tweeting me for one night and watch obama get owned live #debates #presidentialdebate,0
1427,First question on new job creation. Obama starts off with mentioning his anniversary with FLOTUS and Romney makes a joke. #debates.,34.813127,first question on new job creation obama starts off with mentioning his anniversary with flotus and romney makes a joke #debates,2
873,#Denverdebate Obama starts with wishing Michelle a happy anniversary before talking about jobs -- auto industry&Housing focus where we're going,34.793412,#denverdebate obama starts with wishing michelle a happy anniversary before talking about jobs auto industryhousing focus where we're going,0
113,Government trying to keep education prices low? Lol giving out money to do that has failed and you've saturated the job market #debates,34.742959,government trying to keep education prices low lol giving out money to do that has failed and you've saturated the job market #debates,0
411,Me:boutta watch the presidential debate Him:the one with romney and obama Me: no the one with the othr ppl running for president  Him: who!?,34.694901,meboutta watch the presidential debate himthe one with romney and obama me no the one with the othr ppl running for president him who,0
525,@YouTubePolitics: LIVE NOW: Watch Barack Obama and Mitt Romney in the first US presidential #debate: http://t.co/8YEKVJ6XI'm keen,34.615485,live now watch barack obama and mitt romney in the first us presidential #debate i'm keen,1
2169,LIVE NOW: Watch Barack Obama and Mitt Romney in the first US presidential #debate:  http://t.co/UG7JYBmV,34.615485,live now watch barack obama and mitt romney in the first us presidential #debate,51
2829,#3 get us to the best education system & best schools... & we're far away from that now...  #governorromney #Debates,34.57626400000001,# get us to the best education system best schools we're far away from that now #governorromney #debates,0
2382,Pres. Obama re jobs: We've got to invest in education and training...Question for voters:Do we embrace a new economic patriotism? #debates,34.546152,pres obama re jobs we've got to invest in education and trainingquestion for votersdo we embrace a new economic patriotism #debates,0
2532,@Sohela_Kaur Happy Anniversary To Mrs. & President Michelle and Barack Obama That doesn't even make sense.,34.540864,happy anniversary to mrs president michelle and barack obama that doesn't even make sense,1
1597,The FIRST of Three Presidential Debates ... #DomesticIssues #Debates ... get your family around the TV ... lets go human beings we need this,34.412511,the first of three presidential debates #domesticissues #debates get your family around the tv lets go human beings we need this,0
156,@CBSEveningNews: LIVE NOW: The first 2012 Presidential debate from Denver --  CO. WATCH: http://t.co/OzF0Xkn6  and on CBS stations #debates,34.410385,live now the first presidential debate from denver co watch and on cbs stations #debates,0
1919,I find it heartwarming that he took the time to say something to his wife on their 20th anniversary. I can't wait for it to start #debates,34.370874,i find it heartwarming that he took the time to say something to his wife on their 20th anniversary i can't wait for it to start #debates,0
1168,Just my opinion --  but President Obama is the --  well president. Couldn't the debate have been on any other night than his 20th anniversary?,34.360022,just my opinion but president obama is the well president couldn't the debate have been on any other night than his 20th anniversary,0
3796,Mitt Romney wins first joke of the night - tells President being with him at debate is a romantic anniversary #debate,34.138611000000004,mitt romney wins first joke of the night tells president being with him at debate is a romantic anniversary #debate,0
4458,HAPPY ANNIVERSARY MR. PRESIDENT BARACK OBAMA AND MRS. FIRST LADY MICHELLE OBAMA!!!!!!!!! WE LOVE YOU,34.11192,happy anniversary mr president barack obama and mrs first lady michelle obama we love you,0
4878,I see candidates wore appropriate colored ties. Im sure it helps a lot of voters out there know when to listen and when to go pee. #Debates,34.093070999999995,i see candidates wore appropriate colored ties im sure it helps a lot of voters out there know when to listen and when to go pee #debates,0
2479,#DenverDebate Romney congratulates Obamas on anniversary. Rom tells anecdotes of people losing jobs. Rom says he can help with 5 part plan,33.931332,#denverdebate romney congratulates obamas on anniversary rom tells anecdotes of people losing jobs rom says he can help with part plan,0
1862,I know it took up valuable time but nice to see exchange between both candidates over Obama's anniversary. #debates,33.788672000000005,i know it took up valuable time but nice to see exchange between both candidates over obama's anniversary #debates,0
4845,#debates a woman grabbed Romney's arm and asked I'm out of a job --  can u help me? Wonder if Romney said --  sorry --  you're the 47% don't care lol,33.754566,#debates a woman grabbed romney's arm and asked i'm out of a job can u help me wonder if romney said sorry you're the don't care lol,0
2273,Obama makes a strong point that the education system needs improvement --  keep tuition loan --  lower corporate taxes #debates,33.684821,obama makes a strong point that the education system needs improvement keep tuition loan lower corporate taxes #debates,0
3091,US rivals square off at debate: US President Barack Obama and Republican challenger Mitt Romney have begun the first of three preside...,33.430820999999995,us rivals square off at debate us president barack obama and republican challenger mitt romney have begun the first of three preside,0
3610,Someone better call me when Obama & Romney start Rap battling! Also Can't wait to see the Cage Fight between Michelle O. & Ann R.! #debates,33.236841999999996,someone better call me when obama romney start rap battling also can't wait to see the cage fight between michelle o ann r #debates,0
